id,post_id,page_name,text,timestamp,likes,comments_count,shares,views,reactions_like,reactions_love,reactions_haha,reactions_wow,reactions_sad,reactions_angry,post_url,media_type,scraped_at
79,b3b2a58d8ac0de48145bafd82e555ff7,Join me to Eat Ghana 🇬🇭 pizza for the first time🙂‍↔️ #fypシ #foryouシ #ghana #travelwithme #viral #pizza,Join me to Eat Ghana 🇬🇭 pizza for the first time🙂‍↔️ #fypシ #foryouシ #ghana #travelwithme #viral #pizza,2026-03-13T19:46:48.665717,0,0,0,9500,0,0,0,0,0,0,,image,2026-03-13T19:49:04.510520
62,e97e26adf3a2366848e96a8d8822a4e5,Join me to Eat Ghana 🇬🇭 pizza for the first time🙂‍↔️ #fypシ #foryouシ #ghana #travelwithme #viral #pizza,Join me to Eat Ghana 🇬🇭 pizza for the first time🙂‍↔️ #fypシ #foryouシ #ghana #travelwithme #viral #pizza,2026-03-13T19:46:44.120227,0,0,0,9500,0,0,0,0,0,0,,image,2026-03-13T19:49:04.497515
46,80dc8f5d2a547f65dd3e580e9789a53d,Join me to Eat Ghana 🇬🇭 pizza for the first time🙂‍↔️ #fypシ #foryouシ #ghana #travelwithme #viral #pizza,Join me to Eat Ghana 🇬🇭 pizza for the first time🙂‍↔️ #fypシ #foryouシ #ghana #travelwithme #viral #pizza,2026-03-13T19:46:39.990371,0,0,0,9500,0,0,0,0,0,0,,image,2026-03-13T19:49:04.482776
31,76149a2a2438ef28563f76125e1dec2a,Join me to Eat Ghana 🇬🇭 pizza for the first time🙂‍↔️ #fypシ #foryouシ #ghana #travelwithme #viral #pizza,Join me to Eat Ghana 🇬🇭 pizza for the first time🙂‍↔️ #fypシ #foryouシ #ghana #travelwithme #viral #pizza,2026-03-13T19:46:36.281345,0,0,0,9500,0,0,0,0,0,0,,image,2026-03-13T19:49:04.472986
19,1bec28f6b761bac62821b66fe9c7cb7f,Join me to Eat Ghana 🇬🇭 pizza for the first time🙂‍↔️ #fypシ #foryouシ #ghana #travelwithme #viral #pizza,Join me to Eat Ghana 🇬🇭 pizza for the first time🙂‍↔️ #fypシ #foryouシ #ghana #travelwithme #viral #pizza,2026-03-13T19:46:32.891868,0,0,0,9500,0,0,0,0,0,0,,image,2026-03-13T19:49:04.463781
6,3737e6e5ec05ff3c39e9e940863d7a5b,Join me to Eat Ghana 🇬🇭 pizza for the first time🙂‍↔️ #fypシ #foryouシ #ghana #travelwithme #viral #pizza,Join me to Eat Ghana 🇬🇭 pizza for the first time🙂‍↔️ #fypシ #foryouシ #ghana #travelwithme #viral #pizza,2026-03-13T19:46:29.974280,0,0,0,9500,0,0,0,0,0,0,,image,2026-03-13T19:49:04.450223
1,67c955d3c5c05fbca20a4824dfb1eb9b,official_page,Patience Anima Addo,,0,0,0,0,0,0,0,0,0,0,https://www.facebook.com/eddyspizzaghana/posts/pfbid0XfnMeKfnhYfPmVfPs3nxr4KQePotupbhkr3Cv33gMWT9FgcpgMZMm4JzQgd7uLxtl?comment_id=3373715939576153&__cft__[0]=AZaNO13TWhKr7Z1F_CpdG-yWyfxJIbK_RuHCuQ_jcHD7hLCDQR5WGZXma9xDwaTUBSv8Lufc6vECFCBN9TrHsIjyouRAKktv3uKcn5m1rmIZdDw_tA6t5uctk6iFveITjLqrRAcS9EABrik3Bdxb1JO1pdnJBP41KuK8k29UHaYrH7wD0QAQo7D7kSspJNGcha8&__tn__=R-R,text,2026-03-13T19:46:55.794904
2,c4b98d26ef804f000b0412995fefaf90,search_top,"Pizza place · 70% recommend · ££ · 10.7 km · East Legon Eddys Pizza, East Legon, Ghana · Closing soon",,0,0,0,0,0,0,0,0,0,0,,text,2026-03-13T19:48:21.817300
3,ba3b119ff0d6d88bb1c4967582bae190,search_top,Ghana's Pizza Production,,0,0,0,0,0,0,0,0,0,0,,text,2026-03-13T19:48:21.823638
5,bdc134706faf688d0e59f5afbd54a840,90 Ghana,RK Special Pizza,,0,0,0,118,0,0,0,0,0,0,,image,2026-03-13T19:49:04.448244
7,43d794133880b92be4460da228dbfb12,MINI PIZZA ft NANA’s SHITO ♥️If you need nana’s Shito kindly WhatsApp or Call 0551193561 Website www.nanashito.com Amazon https://a.co/d/9lPp3yJ,MINI PIZZA ft NANA’s SHITO ♥️If you need nana’s Shito kindly WhatsApp or Call 0551193561 Website www.nanashito.com Amazon https://a.co/d/9lPp3yJ,,0,0,0,23000,0,0,0,0,0,0,,image,2026-03-13T19:49:04.451209
8,8153ef0ee019b32c5e8c3f71a6ad636b,Easy bread pizza 🍕 Ingredients: Bread slices Ketchup (or pizza sauce) Grated mozzarella Green bell pepper Red bell pepper Sweet corn Chicken #pizza #homemadepizza #easyrecipe #fyp #reels #viral #lagos #lekki #lagosnigeria #abuja #ikeja #ibadan #portharcourt #kano #kaduna #enugu #naija #nigeria #africa #ghana #tundeednut #instablog #davido #nollywood #explore #explorepage #reelsviral #homemadepizza,Easy bread pizza 🍕 Ingredients: Bread slices Ketchup (or pizza sauce) Grated mozzarella Green bell pepper Red bell pepper Sweet corn Chicken #pizza #homemadepizza #easyrecipe #fyp #reels #viral #lagos #lekki #lagosnigeria #abuja #ikeja #ibadan #portharcourt #kano #kaduna #enugu #naija #nigeria #africa #ghana #tundeednut #instablog #davido #nollywood #explore #explorepage #reelsviral #homemadepizza,,0,0,0,274000,0,0,0,0,0,0,,image,2026-03-13T19:49:04.451908
9,562ac24ef261af355040e68a83823f4b,We live in a country where Eddy's pizza even arrives on time than fire service.... Oohh Ghana😭😭😭😭😭😭,We live in a country where Eddy's pizza even arrives on time than fire service.... Oohh Ghana😭😭😭😭😭😭,,0,0,0,212,0,0,0,0,0,0,https://www.facebook.com/kamal.dansani/videos/10155445269070412/,image,2026-03-13T19:49:04.452778
12,c5cdaf9b57e7f5f6fde033a2adc4f893,Eddy's pizza,Celebrate Accra mall’s Foodie month at Eddys pizza.🍕🥤🍔🥪🥗 Visit our cozy restaurant with tasty food and drinks that will delight you at cost-efficient rates. Call Now 0503114666 to place your order now #accramall #foodiemonth #eddyspizza,,0,0,0,1800,0,0,0,0,0,0,,image,2026-03-13T19:49:04.455318
13,30bf52de5e95f511138d42260e24dcd7,Cake Fest 2025 🎂 @buttercreamqueen_ghana @dj_ernie_ @cocktails_ghana @abisfoodlab @mc__dela @mckofidalinton @eddy_acquah @officialokokobioko @1mr_wazza #cakefest #afterparty,Cake Fest 2025 🎂 @buttercreamqueen_ghana @dj_ernie_ @cocktails_ghana @abisfoodlab @mc__dela @mckofidalinton @eddy_acquah @officialokokobioko @1mr_wazza #cakefest #afterparty,,0,0,0,1000,0,0,0,0,0,0,,image,2026-03-13T19:49:04.455992
14,e5f391542b52435bf105b1c7d33d0485,Homemade pizza 🍕 Afenhyia Pa!,Homemade pizza 🍕 Afenhyia Pa!,,0,0,0,2300,0,0,0,0,0,0,,image,2026-03-13T19:49:04.457076
15,508229f92b3d5108c38e101079f487f1,East Legon has gathered and Ghana must watch. Welcome to the annual New Year’s all white party of the Lindsay’s. Yes you’ve heard the name before. Mr Lindsay is the Chancellor of the Cape Coast Technical University and this evening he is hosting all of us. Stay with us the party is just getting started. Content creators: @osei_douglas_live @eventbuzzgh @weloveghanaweddings Cocktails: @honeyandsuchrefreshments Mc: @eddy_acquah Dj: @peekayaudio #newyearsparty #allwhiteparty #thelindsays,East Legon has gathered and Ghana must watch. Welcome to the annual New Year’s all white party of the Lindsay’s. Yes you’ve heard the name before. Mr Lindsay is the Chancellor of the Cape Coast Technical University and this evening he is hosting all of us. Stay with us the party is just getting started. Content creators: @osei_douglas_live @eventbuzzgh @weloveghanaweddings Cocktails: @honeyandsuchrefreshments Mc: @eddy_acquah Dj: @peekayaudio #newyearsparty #allwhiteparty #thelindsays,,0,0,0,7300,0,0,0,0,0,0,,image,2026-03-13T19:49:04.460060
16,b0d29bb53d06c0564076dbc80a7df71e,Food battles- Papa's Pizza vs Eddy's Pizza - Taste Tales Show,Food battles- Papa's Pizza vs Eddy's Pizza - Taste Tales Show,,0,0,0,179,0,0,0,0,0,0,,image,2026-03-13T19:49:04.461731
23,91e87cfc865a06fce75273695eab4ae9,Christmas no be only rice 😌🍕 Eddy's Pizza🍕 made sure the kids in my hood chopped good and smiled harder. Blessed season 🎄❤️ #fyp #ghanatiktok🇬🇭 #viral #pizza #trendingreelsvideo,Christmas no be only rice 😌🍕 Eddy's Pizza🍕 made sure the kids in my hood chopped good and smiled harder. Blessed season 🎄❤️ #fyp #ghanatiktok🇬🇭 #viral #pizza #trendingreelsvideo,,0,0,0,3400,0,0,0,0,0,0,,image,2026-03-13T19:49:04.466628
24,b51cbf5ee923bd0a3024b52be5e16747,"COMIC AWARDS GHANA 🇬🇭 🔖Venue : National Theatre. 📆Date : Friday 1st September, 2017 ⏱Time: 7pm Sharp. Performing Live: Kenny Blaq || DKB || Lekzy || Romanus || Jacinta ||Khemikal || Hogan || Irene. Ticket Outlets. 📌Silver Bird Cinema (Accra Mall) 📌Eddy's Pizza 🍕 (Circle) 📌Chix n Ribs (A&C Mall) 📌Airport Shell Filling Station For more info and Ticket. 📞020 306 2808 📞027 107 4611","COMIC AWARDS GHANA 🇬🇭 🔖Venue : National Theatre. 📆Date : Friday 1st September, 2017 ⏱Time: 7pm Sharp. Performing Live: Kenny Blaq || DKB || Lekzy || Romanus || Jacinta ||Khemikal || Hogan || Irene. Ticket Outlets. 📌Silver Bird Cinema (Accra Mall) 📌Eddy's Pizza 🍕 (Circle) 📌Chix n Ribs (A&C Mall) 📌Airport Shell Filling Station For more info and Ticket. 📞020 306 2808 📞027 107 4611",,0,0,0,46,0,0,0,0,0,0,,image,2026-03-13T19:49:04.467296
27,508faf8121cf39fe9bfc386cb5c47dd0,"Modern bathrooms deserve TranQ 🖤 🌐 𝗪𝗲𝗯𝘀𝗶𝘁𝗲 : alanyogroup.com ☎️ 𝗛𝗼𝘁𝗹𝗶𝗻𝗲 :+233531978362 📌📌𝗦𝗵𝗼𝘄𝗿𝗼𝗼𝗺 :Weija-Kasoa main road, opposite eddy’s pizza or phastor limited Sampa valley, Accra Ghana 🇬🇭. #TranQ #AlanyoGroup #LuxuryBathroom #BlackVanity #BathroomDesign #GhanaHomes #InteriorGhana #HomeUpgrade","Modern bathrooms deserve TranQ 🖤 🌐 𝗪𝗲𝗯𝘀𝗶𝘁𝗲 : alanyogroup.com ☎️ 𝗛𝗼𝘁𝗹𝗶𝗻𝗲 :+233531978362 📌📌𝗦𝗵𝗼𝘄𝗿𝗼𝗼𝗺 :Weija-Kasoa main road, opposite eddy’s pizza or phastor limited Sampa valley, Accra Ghana 🇬🇭. #TranQ #AlanyoGroup #LuxuryBathroom #BlackVanity #BathroomDesign #GhanaHomes #InteriorGhana #HomeUpgrade",,0,0,0,604,0,0,0,0,0,0,,image,2026-03-13T19:49:04.470106
28,93106505293fbc8d6e802b7fb778a654,LCS ALUMNI TALK - Eddy Blay,LCS ALUMNI TALK - Eddy Blay,,0,0,0,410,0,0,0,0,0,0,,image,2026-03-13T19:49:04.470730
38,e94049cdb752459f42328b3c70032d7e,"Gifted Music presents Kingzkid Amplified 2017 📢📢📢📣📣📣 Date : 5th August 2017 Venue : KICC Dominion Center near the Coca Cola round about TIME : 12 Pm sharp! RATE: Totally FREE!!! PARTNERS : Eddy's Pizza, KICC Ghana and Finmock #YEAHHBOIYYY #AmplifiedGoPap 😎","Gifted Music presents Kingzkid Amplified 2017 📢📢📢📣📣📣 Date : 5th August 2017 Venue : KICC Dominion Center near the Coca Cola round about TIME : 12 Pm sharp! RATE: Totally FREE!!! PARTNERS : Eddy's Pizza, KICC Ghana and Finmock #YEAHHBOIYYY #AmplifiedGoPap 😎",,0,0,0,158,0,0,0,0,0,0,,image,2026-03-13T19:49:04.477467
39,692979d0221c0dbe699cf53926f8c133,"This is hotel-level luxury ✨ TranQ double-bowl vanity Now ₵9,500 🌐 𝗪𝗲𝗯𝘀𝗶𝘁𝗲 : alanyogroup.com ☎️ 𝗛𝗼𝘁𝗹𝗶𝗻𝗲 :+233531978362 📌📌𝗦𝗵𝗼𝘄𝗿𝗼𝗼𝗺 :Weija-Kasoa main road, opposite eddy’s pizza or phastor limited Sampa valley, Accra Ghana 🇬🇭. #TranQ #LuxuryBathroom #GhanaHomes #BathroomUpgrade #InteriorGhana","This is hotel-level luxury ✨ TranQ double-bowl vanity Now ₵9,500 🌐 𝗪𝗲𝗯𝘀𝗶𝘁𝗲 : alanyogroup.com ☎️ 𝗛𝗼𝘁𝗹𝗶𝗻𝗲 :+233531978362 📌📌𝗦𝗵𝗼𝘄𝗿𝗼𝗼𝗺 :Weija-Kasoa main road, opposite eddy’s pizza or phastor limited Sampa valley, Accra Ghana 🇬🇭. #TranQ #LuxuryBathroom #GhanaHomes #BathroomUpgrade #InteriorGhana",,0,0,0,4200,0,0,0,0,0,0,https://www.facebook.com/reel/1404582184550136/,image,2026-03-13T19:49:04.478123
40,bdd19325dd4c005a16d9a85d449483b1,"Every detail speaks premium — TranQ Vanity. 🔥 🌐 𝗪𝗲𝗯𝘀𝗶𝘁𝗲 : alanyogroup.com ☎️ 𝗛𝗼𝘁𝗹𝗶𝗻𝗲 :+233531978362 📌📌𝗦𝗵𝗼𝘄𝗿𝗼𝗼𝗺 :Weija-Kasoa main road, opposite eddy’s pizza or phastor limited Sampa valley, Accra Ghana 🇬🇭. #TranQ #TranQVanity #BathroomAesthetics #LuxuryBathroom #VanityGoals #BathroomDesign #ModernBathroom #InteriorInspo #HomeDecorGhana #AestheticBathroom #BathroomStyle #VanityInspo #MarbleVibes #LuxuryLiving #BathroomMakeover #AlanyoGroup #TranQBathroom #GhanaHomes #BathroomGoals #DesignInspo","Every detail speaks premium — TranQ Vanity. 🔥 🌐 𝗪𝗲𝗯𝘀𝗶𝘁𝗲 : alanyogroup.com ☎️ 𝗛𝗼𝘁𝗹𝗶𝗻𝗲 :+233531978362 📌📌𝗦𝗵𝗼𝘄𝗿𝗼𝗼𝗺 :Weija-Kasoa main road, opposite eddy’s pizza or phastor limited Sampa valley, Accra Ghana 🇬🇭. #TranQ #TranQVanity #BathroomAesthetics #LuxuryBathroom #VanityGoals #BathroomDesign #ModernBathroom #InteriorInspo #HomeDecorGhana #AestheticBathroom #BathroomStyle #VanityInspo #MarbleVibes #LuxuryLiving #BathroomMakeover #AlanyoGroup #TranQBathroom #GhanaHomes #BathroomGoals #DesignInspo",,0,0,0,6300,0,0,0,0,0,0,,image,2026-03-13T19:49:04.478789
41,2103f5f1fc950667c241cd9d203652e9,Event Secured By @goldmaxxsecurity @inspiredby_efia@focusandblur @blaqeyephotography @reelsbynanakwame @kelelplux @nb_ events_ @nb_events_ @kelon_events @reggies_makeovers @ariyike_mua @she.boss1 @hairbyadefunkeee @facelabgh @Bernice_signature_studio @sadiesbridal @dashis_label @naehays @zeeyona_gh @zeeyona_gh @bombom.s_Klothing @avant_la_robe @decy_world @afyas_klosset @gwin_atelier @milirv_ @sherryoge @gillz_gh @adeles_millinery @adeles_millinery @completeeventnflowers @ny_atelier_ @osebo_the_fashionking @djalphagh @dj_blaze_eventsgh @mcextraordinaire @eddy_acquah @inspired_ushers @inspired_ushers @mc_anointing @idemcusine @torias.touch @cocktails_ghana @mannys_bar @idemcusine @drinkz_n_cheersgh @de_bakers_king #goldmaxxsecuriry #eventsecurity #proudtoprotect,Event Secured By @goldmaxxsecurity @inspiredby_efia@focusandblur @blaqeyephotography @reelsbynanakwame @kelelplux @nb_ events_ @nb_events_ @kelon_events @reggies_makeovers @ariyike_mua @she.boss1 @hairbyadefunkeee @facelabgh @Bernice_signature_studio @sadiesbridal @dashis_label @naehays @zeeyona_gh @zeeyona_gh @bombom.s_Klothing @avant_la_robe @decy_world @afyas_klosset @gwin_atelier @milirv_ @sherryoge @gillz_gh @adeles_millinery @adeles_millinery @completeeventnflowers @ny_atelier_ @osebo_the_fashionking @djalphagh @dj_blaze_eventsgh @mcextraordinaire @eddy_acquah @inspired_ushers @inspired_ushers @mc_anointing @idemcusine @torias.touch @cocktails_ghana @mannys_bar @idemcusine @drinkz_n_cheersgh @de_bakers_king #goldmaxxsecuriry #eventsecurity #proudtoprotect,,0,0,0,0,0,0,0,0,0,0,,image,2026-03-13T19:49:04.479400
43,c77c5a1e35454296b584ab349700f69f,"New Stock Arrival! Luxury TranQ Vanity with LED mirror, faucet, waste trap & 5-year warranty. 🌐 𝗪𝗲𝗯𝘀𝗶𝘁𝗲 : alanyogroup.com ☎️ 𝗛𝗼𝘁𝗹𝗶𝗻𝗲 :+233531978362 📌📌𝗦𝗵𝗼𝘄𝗿𝗼𝗼𝗺 :Weija-Kasoa main road, opposite eddy’s pizza or phastor limited Sampa valley, Accra Ghana 🇬🇭. #TranQ #NewArrival #LuxuryBathroom #AlanyoGroup #GhanaHomes","New Stock Arrival! Luxury TranQ Vanity with LED mirror, faucet, waste trap & 5-year warranty. 🌐 𝗪𝗲𝗯𝘀𝗶𝘁𝗲 : alanyogroup.com ☎️ 𝗛𝗼𝘁𝗹𝗶𝗻𝗲 :+233531978362 📌📌𝗦𝗵𝗼𝘄𝗿𝗼𝗼𝗺 :Weija-Kasoa main road, opposite eddy’s pizza or phastor limited Sampa valley, Accra Ghana 🇬🇭. #TranQ #NewArrival #LuxuryBathroom #AlanyoGroup #GhanaHomes",,0,0,0,1200,0,0,0,0,0,0,,image,2026-03-13T19:49:04.480582
44,846ed2e0bd9a3c2c29a697f8c91d33f1,This is for you,"🛑 WAIT! Don’t scroll. If your bathroom still looks basic… this is your upgrade moment. Black. Bold. TranQ. Introducing the 120cm TranQ Vanity Set with LED Mirror, built for homeowners who want their space to feel like a luxury hotel suite every single day. Imagine this: - A sleek matte black finish that commands attention - A spacious 120cm vanity for effortless organization - A modern LED mirror that elevates your entire bathroom ambiance - A clean, premium look that instantly upgrades your home value NOW only GHS6,586 ☎️ Hotline: +233531978362 📍 Showroom: Weija–Kasoa Main Road, opposite Eddy’s Pizza / Phastor Limited, Sampa Valley – Accra, Ghana 🇬🇭 #KitchenSinkPriceInGhana #BuyKitchenSinkInAccra #SUS304KitchenSink #NanoStainlessSteelSink #NoRustKitchenSink #ModernKitchenGhana #KitchenUpgrade #HomeImprovementGhana #AlanyoGroup",,0,0,0,1100,0,0,0,0,0,0,https://www.facebook.com/reel/2398744920560447/,image,2026-03-13T19:49:04.481324
54,640ec820edf9d58b5f25e98b69638f11,"TranQ premium vanity cabinets. 🌐 𝗪𝗲𝗯𝘀𝗶𝘁𝗲 : alanyogroup.com ☎️ 𝗛𝗼𝘁𝗹𝗶𝗻𝗲 :+233531978362 📌📌𝗦𝗵𝗼𝘄𝗿𝗼𝗼𝗺 :Weija-Kasoa main road, opposite eddy’s pizza. Sampa valley. #blacksheriff #bathroom #trendingtiles #sanitarywares #ghana #tranQ #newarrivals #spintexghana #realestateforsale #realeastate #realestatebroker #realtor #realestatemarketing #africa #realeastategh #ghanarealestates #ghanarealestatedevelopers #ghanahomes","TranQ premium vanity cabinets. 🌐 𝗪𝗲𝗯𝘀𝗶𝘁𝗲 : alanyogroup.com ☎️ 𝗛𝗼𝘁𝗹𝗶𝗻𝗲 :+233531978362 📌📌𝗦𝗵𝗼𝘄𝗿𝗼𝗼𝗺 :Weija-Kasoa main road, opposite eddy’s pizza. Sampa valley. #blacksheriff #bathroom #trendingtiles #sanitarywares #ghana #tranQ #newarrivals #spintexghana #realestateforsale #realeastate #realestatebroker #realtor #realestatemarketing #africa #realeastategh #ghanarealestates #ghanarealestatedevelopers #ghanahomes",,0,0,0,947,0,0,0,0,0,0,,image,2026-03-13T19:49:04.489358
55,ada958d81b63282983cbac6c06916fa3,"All-in-one 80cm vanity set with faucets & LED mirror — GH₵1,700. 🌐 𝗪𝗲𝗯𝘀𝗶𝘁𝗲 : alanyogroup.com ☎️ 𝗛𝗼𝘁𝗹𝗶𝗻𝗲 :+233531978362 📌📌𝗦𝗵𝗼𝘄𝗿𝗼𝗼𝗺 :Weija-Kasoa main road, opposite eddy’s pizza or phastor limited Sampa valley, Accra Ghana 🇬🇭. #TranQ #AlanyoGroup #LuxuryBathroom #GhanaHomes #HomeUpgrade","All-in-one 80cm vanity set with faucets & LED mirror — GH₵1,700. 🌐 𝗪𝗲𝗯𝘀𝗶𝘁𝗲 : alanyogroup.com ☎️ 𝗛𝗼𝘁𝗹𝗶𝗻𝗲 :+233531978362 📌📌𝗦𝗵𝗼𝘄𝗿𝗼𝗼𝗺 :Weija-Kasoa main road, opposite eddy’s pizza or phastor limited Sampa valley, Accra Ghana 🇬🇭. #TranQ #AlanyoGroup #LuxuryBathroom #GhanaHomes #HomeUpgrade",,0,0,0,8100,0,0,0,0,0,0,https://www.facebook.com/reel/863464283261296/,image,2026-03-13T19:49:04.490549
56,072370766ea9d3908233c70991a9352b,Nigeria Vs Ghana,Nigeria Vs Ghana,,0,0,0,147,0,0,0,0,0,0,,image,2026-03-13T19:49:04.491376
57,e09c88326eb2b682c63236c266de74fc,Comedy and music night happening this week Saturday 14th December 2019 @ Bustop near Eddy's pizza ring road Accra Ghana by 7pm,Comedy and music night happening this week Saturday 14th December 2019 @ Bustop near Eddy's pizza ring road Accra Ghana by 7pm,,0,0,0,2,0,0,0,0,0,0,,image,2026-03-13T19:49:04.492394
58,2ad71708230423aefee377388798b55b,"🆕 New TranQ Vanity Stock! LED mirror • Faucet • Waste trap • 5-Year Warranty Price :1,980GH ☎️ 𝗛𝗼𝘁𝗹𝗶𝗻𝗲 :+233531978362 📌📌𝗦𝗵𝗼𝘄𝗿𝗼𝗼𝗺 :Weija-Kasoa main road, opposite eddy’s pizza or phastor limited Sampa valley, Accra Ghana 🇬🇭. #TranQ #LuxuryBathroom #AlanyoGroup","🆕 New TranQ Vanity Stock! LED mirror • Faucet • Waste trap • 5-Year Warranty Price :1,980GH ☎️ 𝗛𝗼𝘁𝗹𝗶𝗻𝗲 :+233531978362 📌📌𝗦𝗵𝗼𝘄𝗿𝗼𝗼𝗺 :Weija-Kasoa main road, opposite eddy’s pizza or phastor limited Sampa valley, Accra Ghana 🇬🇭. #TranQ #LuxuryBathroom #AlanyoGroup",,0,0,0,2600,0,0,0,0,0,0,,image,2026-03-13T19:49:04.493404
60,9e4cc0e05396527d907e29b0fe8a117c,"TRANQ SUS304 Nano Handmade Kitchen Sink. Key Features: • Premium SUS304 stainless steel – rust-proof & food-safe • Nano coating – resists scratches, oil & water stains • Handmade construction – thicker steel, stronger build • Easy to clean & maintain • Designed for modern & luxury kitchens 🌐 𝗪𝗲𝗯𝘀𝗶𝘁𝗲 : alanyogroup.com ☎️ 𝗛𝗼𝘁𝗹𝗶𝗻𝗲 :+233531978362 📌📌𝗦𝗵𝗼𝘄𝗿𝗼𝗼𝗺 :Weija-Kasoa main road, opposite eddy’s pizza or phastor limited Sampa valley, Accra Ghana 🇬🇭. #SUS304Sink #NanoSink #PremiumKitchen #ModernKitchen #KitchenUpgrade #GhanaHomes #AlanyoGroup","TRANQ SUS304 Nano Handmade Kitchen Sink. Key Features: • Premium SUS304 stainless steel – rust-proof & food-safe • Nano coating – resists scratches, oil & water stains • Handmade construction – thicker steel, stronger build • Easy to clean & maintain • Designed for modern & luxury kitchens 🌐 𝗪𝗲𝗯𝘀𝗶𝘁𝗲 : alanyogroup.com ☎️ 𝗛𝗼𝘁𝗹𝗶𝗻𝗲 :+233531978362 📌📌𝗦𝗵𝗼𝘄𝗿𝗼𝗼𝗺 :Weija-Kasoa main road, opposite eddy’s pizza or phastor limited Sampa valley, Accra Ghana 🇬🇭. #SUS304Sink #NanoSink #PremiumKitchen #ModernKitchen #KitchenUpgrade #GhanaHomes #AlanyoGroup",,0,0,0,15000,0,0,0,0,0,0,https://www.facebook.com/reel/874024578927877/,image,2026-03-13T19:49:04.495320
71,3d30a8d22aef162e2262994612418808,Buy Now,"🚨 Wait… before you buy that Kitchen Cabinet... What if you could get everything in one complete set, without chasing plumbers and extra fittings? Introducing the All-In-One 80cm Vanity Set, designed for smart homeowners who want style and convenience. Here’s what makes this a steal: ✔ 80cm modern vanity cabinet ✔ Premium sink basin ✔ Faucets included ✔ LED mirror included ✔ Clean, space-saving design No hidden extras. No surprise costs. Just install and enjoy. All for only GH₵1,700. 🌐 Website: alanyogroup.com ☎️ Hotline: +233531978362 📍 Showroom: Weija–Kasoa Main Road, opposite Eddy’s Pizza / Phastor Limited, Sampa Valley – Accra, Ghana 🇬🇭 #KitchenSinkPriceInGhana #BuyKitchenSinkInAccra #SUS304KitchenSink #NanoStainlessSteelSink #NoRustKitchenSink #ModernKitchenGhana #KitchenUpgrade #HomeImprovementGhana #AlanyoGroup",,0,0,0,2000,0,0,0,0,0,0,https://www.facebook.com/reel/2854027551466535/,image,2026-03-13T19:49:04.505698
73,2b12f08c5aa78eed2af273927f5d3f95,"Elevate your shower game with our Premium TranQ Shower Set . Experience luxury, style, and comfort every time you step in. 🌐 𝗪𝗲𝗯𝘀𝗶𝘁𝗲 : alanyogroup.com ☎️ 𝗛𝗼𝘁𝗹𝗶𝗻𝗲 :+233531978362 📌📌𝗦𝗵𝗼𝘄𝗿𝗼𝗼𝗺 :Weija-Kasoa main road, opposite eddy’s pizza. Sampa valley. #ShowerGoals #LuxuryLiving #HomeUpgrade #bathroom #blacksheriff #ghana #sanitarywares #twyford #trendingtiles #trendingtiles #twyfordtiles #basin #bathroom #tranQ #showerideas #shower","Elevate your shower game with our Premium TranQ Shower Set . Experience luxury, style, and comfort every time you step in. 🌐 𝗪𝗲𝗯𝘀𝗶𝘁𝗲 : alanyogroup.com ☎️ 𝗛𝗼𝘁𝗹𝗶𝗻𝗲 :+233531978362 📌📌𝗦𝗵𝗼𝘄𝗿𝗼𝗼𝗺 :Weija-Kasoa main road, opposite eddy’s pizza. Sampa valley. #ShowerGoals #LuxuryLiving #HomeUpgrade #bathroom #blacksheriff #ghana #sanitarywares #twyford #trendingtiles #trendingtiles #twyfordtiles #basin #bathroom #tranQ #showerideas #shower",,0,0,0,615,0,0,0,0,0,0,,image,2026-03-13T19:49:04.506901
74,1bc76ebc25f69f6a804a8e53d4f2336a,"Chale, no dull! WC promo dey run — small money, big shine. 🌐 𝗪𝗲𝗯𝘀𝗶𝘁𝗲 : alanyogroup.com ☎️ 𝗛𝗼𝘁𝗹𝗶𝗻𝗲 :+233531978362 📌📌𝗦𝗵𝗼𝘄𝗿𝗼𝗼𝗺 :Weija-Kasoa main road, opposite eddy’s pizza. Sampa valley. #bathroom #sanitarywares #twyfordtiles #ghanahomes #ghana #spintexghana #spintex #spintexroad #basins","Chale, no dull! WC promo dey run — small money, big shine. 🌐 𝗪𝗲𝗯𝘀𝗶𝘁𝗲 : alanyogroup.com ☎️ 𝗛𝗼𝘁𝗹𝗶𝗻𝗲 :+233531978362 📌📌𝗦𝗵𝗼𝘄𝗿𝗼𝗼𝗺 :Weija-Kasoa main road, opposite eddy’s pizza. Sampa valley. #bathroom #sanitarywares #twyfordtiles #ghanahomes #ghana #spintexghana #spintex #spintexroad #basins",,0,0,0,55000,0,0,0,0,0,0,https://www.facebook.com/reel/727047223661924/,image,2026-03-13T19:49:04.507471
77,1bb1f382958ec480991dbeda70357eec,"Premium Fluted Panels 💰:85GH Size :9ft long 17cm wide ☎️ 𝗛𝗼𝘁𝗹𝗶𝗻𝗲 :+233531978362 📌📌𝗦𝗵𝗼𝘄𝗿𝗼𝗼𝗺 :Weija-Kasoa main road, opposite eddy’s pizza or phastor limited Sampa valley, Accra Ghana 🇬🇭. #blacksheriff #ghana #sanitarywares #flutedpanels #wallpanelling #deco #tranQ #spintexaccra #african #walldecoration #decoration","Premium Fluted Panels 💰:85GH Size :9ft long 17cm wide ☎️ 𝗛𝗼𝘁𝗹𝗶𝗻𝗲 :+233531978362 📌📌𝗦𝗵𝗼𝘄𝗿𝗼𝗼𝗺 :Weija-Kasoa main road, opposite eddy’s pizza or phastor limited Sampa valley, Accra Ghana 🇬🇭. #blacksheriff #ghana #sanitarywares #flutedpanels #wallpanelling #deco #tranQ #spintexaccra #african #walldecoration #decoration",,0,0,0,46000,0,0,0,0,0,0,https://www.facebook.com/reel/2199640287191133/,image,2026-03-13T19:49:04.509147
92,40b61332d34f26fdeb2dacd7de96800a,"Rust-free. Scratch-resistant. Premium finish. SUS304 Nano Handmade Sink — ₵2,660. SIZE: 100cm by 46cm 🌐 𝗪𝗲𝗯𝘀𝗶𝘁𝗲 : alanyogroup.com ☎️ 𝗛𝗼𝘁𝗹𝗶𝗻𝗲 :+233531978362 📌📌𝗦𝗵𝗼𝘄𝗿𝗼𝗼𝗺 :Weija-Kasoa main road, opposite eddy’s pizza or phastor limited Sampa valley, Accra Ghana 🇬🇭. #SUS304Sink #NanoKitchenSink #PremiumKitchenGhana #LuxuryKitchen #GhanaHomes #KitchenUpgrade #HomeImprovementGhana #ModernKitchen #QualityKitchen #AlanyoGroup","Rust-free. Scratch-resistant. Premium finish. SUS304 Nano Handmade Sink — ₵2,660. SIZE: 100cm by 46cm 🌐 𝗪𝗲𝗯𝘀𝗶𝘁𝗲 : alanyogroup.com ☎️ 𝗛𝗼𝘁𝗹𝗶𝗻𝗲 :+233531978362 📌📌𝗦𝗵𝗼𝘄𝗿𝗼𝗼𝗺 :Weija-Kasoa main road, opposite eddy’s pizza or phastor limited Sampa valley, Accra Ghana 🇬🇭. #SUS304Sink #NanoKitchenSink #PremiumKitchenGhana #LuxuryKitchen #GhanaHomes #KitchenUpgrade #HomeImprovementGhana #ModernKitchen #QualityKitchen #AlanyoGroup",,0,0,0,58000,0,0,0,0,0,0,https://www.facebook.com/reel/1586825236073419/,image,2026-03-13T19:49:04.517518
