comment_id,video_id,author_name,author_channel_id,text,likes,published_at,updated_at,is_reply,parent_id,reply_count,scraped_at
UgxQZJUCpdXNjVH-Rpl4AaABAg,xwLrHUwGtJM,@Joycelyn_Acquah,,BIGGEST BURLAND 🎉,1,2026-03-08T01:39:58.185409+00:00,,0,,0,2026-03-17T23:27:23.146322
UgwDvtBYPDWL9kPzhqZ4AaABAg,xwLrHUwGtJM,@abenataylor7923,,I think they look good together ❤💜🤭,0,2026-03-08T01:39:57.467795+00:00,,0,,0,2026-03-17T23:27:23.144318
UgwM_olC_UoP7brtukB4AaABAg,xwLrHUwGtJM,@naadzormorkotey2742,,I just love ❤️ Princess and everything about her,0,2026-03-08T01:39:57.467787+00:00,,0,,0,2026-03-17T23:27:23.143043
Ugx7bY-Kh_p2KLR41ip4AaABAg,xwLrHUwGtJM,@AJ-genius1,,I’m going to be on ur platform sooner,0,2026-03-08T01:39:57.467769+00:00,,0,,0,2026-03-17T23:27:23.139988
UgxeAgKP9j7KAvb1tCJ4AaABAg,xwLrHUwGtJM,@JohnAnokye-sh6xt,,"Sound is 🔝 
Camera quality is 🔝 
She's gorgeous as well, so the bullies can go to hell. 
I like her mentality of making the most out of the years she stays relevant because she realizes that she won't have this spotlight forever.
Derrick and money 😅...l love you mæn. 
Overall good show.",6,2026-03-08T01:39:57.467759+00:00,,0,,0,2026-03-17T23:27:23.141854
UgzWHfHoqtqAIFUMwjl4AaABAg,xwLrHUwGtJM,@kellyal-son7743,,"I made it to the end that’s interesting 
First time here😊",0,2026-03-08T01:39:57.467746+00:00,,0,,0,2026-03-17T23:27:23.139638
UgzBZ_xp5mKhyyEZS_N4AaABAg,xwLrHUwGtJM,@kellyal-son7743,,"I made it to the end that’s interesting 
First time here😊",0,2026-03-08T01:39:57.467737+00:00,,0,,0,2026-03-17T23:27:23.137209
UgzvZUBIHzDqsCpAmQl4AaABAg,xwLrHUwGtJM,@AbrahamKwabena2,,Powerful,0,2026-03-08T01:39:57.467704+00:00,,0,,0,2026-03-17T23:27:23.125038
UgyOoqOJwpd399O8mYl4AaABAg,xwLrHUwGtJM,@AkotoJosephine1,,I made it to the end 😊😊,0,2026-03-08T01:39:57.467506+00:00,,0,,0,2026-03-17T23:27:23.135729
UgwKrH7a42sOT6nZT9F4AaABAg,xwLrHUwGtJM,@e.4_Enock,,"❤❤❤loved everything, especially the starting 0:39",0,2026-03-08T01:39:57.467489+00:00,,0,,0,2026-03-17T23:27:23.128515
Ugyx82Q5hy0Icm8nNIR4AaABAg,xwLrHUwGtJM,@wilikashilongo3273,,This is highly motivating ❤❤❤,0,2026-03-08T01:39:57.467414+00:00,,0,,0,2026-03-17T23:27:23.135278
UgzlPTSymMj78VZGXkh4AaABAg,xwLrHUwGtJM,@ammahdynnah,,I made it to the end,1,2026-03-08T01:39:57.467394+00:00,,0,,0,2026-03-17T23:27:23.122112
UgwOUhWcENU2s6Rr7fd4AaABAg,xwLrHUwGtJM,@daniellafosu9778,,"I love Ama so much ❤
She is intelligent, beautiful and a very smart lady❤
She has inspired me alot❤",0,2026-03-08T01:39:57.467382+00:00,,0,,0,2026-03-17T23:27:23.134538
UgxfGn0xk6YFYU770ud4AaABAg,xwLrHUwGtJM,@LadyAii,,"i want to learn from Ama Burland, please add me to those girls you want to help. Thank you for the podcast",1,2026-03-08T01:39:57.467321+00:00,,0,,0,2026-03-17T23:27:23.130844
UgzKoR0rLXvnM6Y4j-F4AaABAg,xwLrHUwGtJM,@DeborahMeyer-s8k,,AMa really likes Sark🥰😊,0,2026-03-08T01:39:56.852101+00:00,,0,,0,2026-03-17T23:27:23.145915
Ugy2ieIjAi_e2g-3PSF4AaABAg,xwLrHUwGtJM,@vivianawatthenshaw3918,,"Ama is very Real.
I made it to the end",0,2026-03-08T01:39:56.852098+00:00,,0,,0,2026-03-17T23:27:23.124386
UgyJQ48o0zMsr54Fo6J4AaABAg,xwLrHUwGtJM,@Oceanvibes-m6b,,I always and will make it the end of any video on this channel 🎉❤,0,2026-03-08T01:39:56.852095+00:00,,0,,0,2026-03-17T23:27:23.138918
Ugyz8uwLs-lhbf2P-3l4AaABAg,xwLrHUwGtJM,@naadzormorkotey2742,,I would also make it to your studio one day,0,2026-03-08T01:39:56.852087+00:00,,0,,0,2026-03-17T23:27:23.142695
UgzoxUekYhyTfcLuUEp4AaABAg,xwLrHUwGtJM,@CS_CHILD,,She was honest with her talks 🙏🤝🙏😪.,0,2026-03-08T01:39:56.852078+00:00,,0,,0,2026-03-17T23:27:23.124720
UgwZdU3-I7mMiqR1H5Z4AaABAg,xwLrHUwGtJM,@phanie5575,,"I love the last part 😂...Konnected mind kindly add that special segment to your podcast. Thus an unconventional thinking segment, it will be fun😊",0,2026-03-08T01:39:56.852071+00:00,,0,,0,2026-03-17T23:27:23.126874
UgzoJdSpwxa2vaArMxp4AaABAg,xwLrHUwGtJM,@OdisikaKwabenaAmankwah,,The Gospel must be preach Derrick ❤❤❤I I'm present today too,0,2026-03-08T01:39:56.852064+00:00,,0,,0,2026-03-17T23:27:23.125758
Ugz0qV_lAa6fIhYk-814AaABAg,xwLrHUwGtJM,@Ms.sakhies_thedesigner,,I made it to the end❤❤,0,2026-03-08T01:39:56.284816+00:00,,0,,0,2026-03-17T23:27:23.127746
UgwkzSjRkbtHGmSBQw54AaABAg,xwLrHUwGtJM,@mensahtheophilus3131,,i really enjoyed this podcast...she is very intelligent,0,2026-03-08T01:39:56.284806+00:00,,0,,0,2026-03-17T23:27:23.128122
UgzoO4m3LU_RmLFKV254AaABAg,xwLrHUwGtJM,@AkotoJosephine1,,Wow very educative episode 😊😊🥰.,0,2026-03-08T01:39:56.284784+00:00,,0,,0,2026-03-17T23:27:23.132863
Ugwxc5dGYIu20aCXA0l4AaABAg,xwLrHUwGtJM,@LifeMadeByRadw,,This popped up in my YouTube recommendations. It was great listening to the perspective of a young Ghanaian woman in business - found some moments quite relatable being an entrepreneur as well. Ps: loved the way the interviewer now became the interviewee towards the end 😂,1,2026-03-08T01:39:56.284739+00:00,,0,,0,2026-03-17T23:27:23.121460
UgzWc-zyKBiYM9XX_Qh4AaABAg,xwLrHUwGtJM,@thedhinelle,,I love this so much❤,0,2026-03-08T01:39:56.284705+00:00,,0,,0,2026-03-17T23:27:23.118992
UgxLma-ku2NdyafRQKV4AaABAg,xwLrHUwGtJM,@EdwardGligah,,"This is an amazing piece filled with so much wise words… funny too😂
Enjoyed every second of it.",0,2026-03-08T01:39:56.284621+00:00,,0,,0,2026-03-17T23:27:23.115019
UgwThpg33tTOjGaVm294AaABAg,xwLrHUwGtJM,@pakuamoah11,,"I made it to the end.
Nice interview; I picked a thing or two.",0,2026-03-08T01:39:56.284593+00:00,,0,,0,2026-03-17T23:27:23.114618
Ugwku0lRpO7wyPVuo5t4AaABAg,xwLrHUwGtJM,@oliviaamfo-swanzy7667,,19:37 Beautiful analogy❤,0,2026-03-08T01:39:55.685019+00:00,,0,,0,2026-03-17T23:27:23.117606
UgwbTqFnPWvPUcD0HgB4AaABAg,xwLrHUwGtJM,@amuchristiana8407,,Very Brilliant ❤❤🫡,1,2026-03-08T01:39:55.685011+00:00,,0,,0,2026-03-17T23:27:23.140651
Ugw0JZdD3no-cWwHzgZ4AaABAg,xwLrHUwGtJM,@pearlagyekum6806,,Insightful,1,2026-03-08T01:39:55.684984+00:00,,0,,0,2026-03-17T23:27:23.132512
UgzBkFUQP9CIb2xT4sB4AaABAg,xwLrHUwGtJM,@bizzyklu9639,,this is inspiring,1,2026-03-08T01:39:55.684966+00:00,,0,,0,2026-03-17T23:27:23.134888
Ugw-lXnyPZLisKJ4TxB4AaABAg,xwLrHUwGtJM,@ReginaAsantewaaOfosuhene,,so much insight,0,2026-03-08T01:39:55.684941+00:00,,0,,0,2026-03-17T23:27:23.116658
UgxFviqZevtDrNvRyY14AaABAg,xwLrHUwGtJM,@Godslove-f2k,,This is much……..like ….wow 😊,1,2026-03-08T01:39:55.684932+00:00,,0,,0,2026-03-17T23:27:23.118047
Ugxn4bwtrGtjT1BeV8B4AaABAg,xwLrHUwGtJM,@MarthaArmah-Kessey,,"Kudos
What a lovely interview.
Great answers Ama",0,2026-03-08T01:39:55.023719+00:00,,0,,0,2026-03-17T23:27:23.114002
UgyPn9OAEZIKKbKq_Zt4AaABAg,xwLrHUwGtJM,@faustinaarthur4883,,"The much-awaited episode for me. Love it, love it, love it.

Vry insightful informative and entertaining as well. Great to see how she turned the table to interview you st the end. ❤❤❤❤❤",0,2026-03-08T01:39:55.023696+00:00,,0,,0,2026-03-17T23:27:23.113703
Ugy_SWDnjBDngSg-Kad4AaABAg,xwLrHUwGtJM,@Ohemaaanakwa,,"I love this podcast; Ama has really opened my eyes to a lot of things. Derrick, I need you to be my mentor.",0,2026-03-08T01:39:55.023675+00:00,,0,,0,2026-03-17T23:27:23.113398
Ugwgz6cBVfVkcpw9TvZ4AaABAg,xwLrHUwGtJM,@AbenaNuamahAppiah,,Amazing Amazing episode ❤️ ❤,0,2026-03-08T01:39:55.023651+00:00,,0,,0,2026-03-17T23:27:23.111553
UgxmNAX93jNPcJskc5J4AaABAg,xwLrHUwGtJM,@margaretmankosaansah4986,,I really enjoyed this podcast and I have learnt a lot. Thank you for this❤,0,2026-03-08T01:39:55.023641+00:00,,0,,0,2026-03-17T23:27:23.112769
UgyqaR8N9NBlhn0s6QV4AaABAg,xwLrHUwGtJM,@charitymansah4018,,"Wow, I have never enjoyed a long interview as this, thanks for the insight 👍",0,2026-03-08T01:39:55.023620+00:00,,0,,0,2026-03-17T23:27:23.111870
UgzWWlGNJMJMmP1NTzx4AaABAg,xwLrHUwGtJM,@Maabenadadzie8481,,🎉🎉🎉 I loved every single part of it 🎉🎉🎉,0,2026-03-08T01:39:55.023597+00:00,,0,,0,2026-03-17T23:27:23.111247
UgwRvkEz2LA9HlPh2814AaABAg,xwLrHUwGtJM,@PapaKing-dd2nu,,I made it to the end😊 thank you AMA❤,0,2026-03-08T01:39:55.023588+00:00,,0,,0,2026-03-17T23:27:23.110250
UgwYEAPAUmbEhsjR13V4AaABAg,xwLrHUwGtJM,@obedasamoah8908,,"Nana Aba session brought me to this channel, this session got me subscribing. I love to see women doing well for themselves",0,2026-03-08T01:39:55.023578+00:00,,0,,0,2026-03-17T23:27:23.110930
UgyO1Tu6O1_BuAXI24x4AaABAg,xwLrHUwGtJM,@AyishetuMohammed-d9x,,"I really enjoyed the podcast and I have given you a follow I wish and hope you will bring great women to inspire us 
God bless you for this opportunity Mr Derrick",1,2026-03-08T01:39:55.023551+00:00,,0,,0,2026-03-17T23:27:23.109197
UgySN3tk-AT8riXdNKl4AaABAg,xwLrHUwGtJM,@nanaesiyeboahdadzie4643,,She is indeed a lively and relatable personality. I was interested to listen to the whole converstion,0,2026-03-08T01:39:55.023519+00:00,,0,,0,2026-03-17T23:27:23.109839
UgyFYKIu3XlJv_ZaRLl4AaABAg,xwLrHUwGtJM,@Ms_Coker,,I love this convo❤,0,2026-03-08T01:39:54.404896+00:00,,0,,0,2026-03-17T23:27:23.106420
UgwNxs0PvbtGOgCyVzt4AaABAg,xwLrHUwGtJM,@MikOPolo-ed,,made it. great episode,0,2026-03-08T01:39:54.404886+00:00,,0,,0,2026-03-17T23:27:23.106737
UgzSjApqxOdCdybunMZ4AaABAg,xwLrHUwGtJM,@ZakiaKunge1,,"Princess is such a light 💡 she gives good energy, good vibes and overall positivity 💫",0,2026-03-08T01:39:54.404854+00:00,,0,,0,2026-03-17T23:27:23.104519
UgyWOhNe8exs0t8fdpt4AaABAg,xwLrHUwGtJM,@nora_annor,,"How do I like this post a million times??? Thank you so much Derrick. Thank you so much, Ama Burland for sharing your knowledge. This is very rare to come by. Thank you for your openness and honesty",0,2026-03-08T01:39:54.404790+00:00,,0,,0,2026-03-17T23:27:23.103057
Ugwa3ujvFRLIALYQ_H14AaABAg,xwLrHUwGtJM,@Xxbliss,,I love this interview so much,0,2026-03-08T01:39:54.404779+00:00,,0,,0,2026-03-17T23:27:23.102744
Ugx1JIMSaV4-g_o15zl4AaABAg,xwLrHUwGtJM,@ebodadson9265,,Loved this interview soo much,0,2026-03-08T01:39:53.735318+00:00,,0,,0,2026-03-17T23:27:23.100549
Ugx9fVdjgouWiaRrkMp4AaABAg,xwLrHUwGtJM,@elodiepamazi5244,,She is full of life and funny … Princess  is was she think. she is very thoughtful lady . Another great interview ❤ we love it as usual 👍🏼. Thanks Derick,1,2026-03-08T01:39:53.735299+00:00,,0,,0,2026-03-17T23:27:23.100230
UgwuyWRWdq989Vs2BjF4AaABAg,xwLrHUwGtJM,@RoseAmankwaah-l9l,,"Princess burland really inspires me a lot and because of that I watched this to the end. God bless you for having her on your show, I really needed this🥰",1,2026-03-08T01:39:53.735257+00:00,,0,,0,2026-03-17T23:27:23.098076
UgwlPcETZrgmVjqx4mF4AaABAg,xwLrHUwGtJM,@naadzormorkotey2742,,23:12 money solves a lot of things,1,2026-03-08T01:39:53.735239+00:00,,0,,0,2026-03-17T23:27:23.098405
Ugyc9-XM3gLGNb8-XMt4AaABAg,xwLrHUwGtJM,@JohnAnokye-sh6xt,,So I think we should have a Part 2 of this show. And it should be able Derrick being the guest and Ms Burland being the Host.,0,2026-03-08T01:39:53.735232+00:00,,0,,0,2026-03-17T23:27:23.095635
UgzRixr7ULUQn8lGCDN4AaABAg,xwLrHUwGtJM,@annordeborah2984,,"This is a very good podcast, I have been thinking so much about what to do with the little I’m earning, but the thought of failing at a business prevents me from doing it. Watching this podcast has really changed my mindset. Thank you Derek 
I look forward to having you as my mentor.",2,2026-03-08T01:39:52.852453+00:00,,0,,0,2026-03-17T23:27:23.088064
UgzibWsIOzO9K0wHWNx4AaABAg,xwLrHUwGtJM,@edwardamoako,,"This podcast is wealth it. If you are here in 2026 with me, we are blessed ooo ❤",25,2026-03-08T01:39:52.852366+00:00,,0,,0,2026-03-17T23:27:23.083483
Ugyh9dH3_P1Ju9EdKQt4AaABAg,xwLrHUwGtJM,@amaserwaa5498,,"You are doing a great Job Derrick 👏. I like Ama’s personality, the way she thinks reflects in her everyday life and also in business. That enthusiasm within her I believe drives everything. Keep shining Ama ❤️",1,2026-03-08T01:39:52.123893+00:00,,0,,0,2026-03-17T23:27:23.077050
UgxTTZqQC6xGXMpWrYB4AaABAg,xwLrHUwGtJM,@QuamzBlogz,,Best interview ever🎉❤😊i admire Ama Burland so much she's so brilliant😊,2,2026-03-08T01:39:52.123851+00:00,,0,,0,2026-03-17T23:27:23.074212
UgzQIB1oGIw8qij5C354AaABAg,xwLrHUwGtJM,@AliceNarweh,,I made it to the end as always . Kudos Ama for your inspiration. The champion DERICK I salute you,2,2026-03-08T01:39:52.123771+00:00,,0,,0,2026-03-17T23:27:23.067986
Ugzfvh75g0Cj62Gzi3l4AaABAg,xwLrHUwGtJM,@gh_blaqsoap2846,,"The waiting till one can afford 3X the cost of something is an advice that should be directed to the state/the government (of GH). The average person (who eventually becomes politicians) should also have that awareness at the back of their mind. We tend to think the state (coffers) is an institution to exploit and make money from as opposed to the other way around. They embark on projects (most often with funds borrowed from the IMF) mainly for the procurement contract ""benefit"", without maintenance arrangements in place. The state has to be wealthier to be able to protect its citizens. I watched a video reel sometime back and listened to Kwame Nkrumah's speech during the inauguration ceremony of the Akosombo dam. That speech literally was the beginning of his end! He spoke from both sides of his mouth even as representatives of Kaiser Aluminum (an American company that had funded the dam) were in attendance. America got rid of him (thru the C IA) to ""protect"" an American company's investment.",1,2026-03-08T01:39:52.123759+00:00,,0,,0,2026-03-17T23:27:23.069409
UgwO7oqb9Nh-q55SZ0J4AaABAg,xwLrHUwGtJM,@RahanatAhmed,,Ama is such an amazing person I really like listening to her she has that burning Aura love her so much 💋❤️,3,2026-03-08T01:39:51.486634+00:00,,0,,0,2026-03-17T23:27:23.057884
UgyLr2TtjwtlSIRljwN4AaABAg,xwLrHUwGtJM,@TheSereneLuxe,,Watching this podcast while using diya hair growth oil. She's such an inspiration.,3,2026-03-08T01:39:51.486552+00:00,,0,,0,2026-03-17T23:27:23.053228
Ugx5sw01dtMDAs9Vzgp4AaABAg,xwLrHUwGtJM,@JenniferTeye-ty1mp,,"I watch every episode, but with this, I can't hold back my comment it's wow❤",3,2026-03-08T01:39:50.832556+00:00,,0,,0,2026-03-17T23:27:23.028968
Ugz6mvkyJQ7FP23It914AaABAg,xwLrHUwGtJM,@serenity8551,,''concentrate on why someone wants the cup and get your money up'' bars barsssss,3,2026-03-08T01:39:50.832533+00:00,,0,,0,2026-03-17T23:27:23.025987
Ugz60RI4974EWkViVbF4AaABAg,xwLrHUwGtJM,@esenamdeborah,,"I love this. I just hope for those who are from “hard” homes, it doesn’t entirely shape your view of life and that of your children in a bad way. 
And cheers to everyone finding their foot. Keep believing in you, be tough and let nothing bring you down. You’re at the top ❤",3,2026-03-08T01:39:50.832509+00:00,,0,,0,2026-03-17T23:27:23.024594
UgyMBQd9yb-9JS24rGt4AaABAg,xwLrHUwGtJM,@ErnestinaOwusua-jd1sb,,"I feel so excited and sometimes relieved whenever I watch your show with great men and women such as this learned lady . I am just not inspired , but as you Said  it has digested hope into my Spain , for me to believe in myself , study,work and also fail as it is all part of the journey . Thank you for bringing hope back into our lives and rekindling the light in us. God bless you .",5,2026-03-08T01:39:50.832487+00:00,,0,,0,2026-03-17T23:27:23.022258
UgyQCgZEcE7RNIAkKcR4AaABAg,xwLrHUwGtJM,@SimpleJherph,,Ama Burland always carries a different vibe😂. This is why i love her so much❤🤣.,6,2026-03-08T01:39:50.832479+00:00,,0,,0,2026-03-17T23:27:23.020787
UgynXwH-KQAdBBI5s2h4AaABAg,xwLrHUwGtJM,@filouwgrey,,"Her story is really inspiring, i like her self confidence. I guess i wasn’t the only one who laughed throughout the conversation and didn’t wanted it to end",7,2026-03-08T01:39:50.832438+00:00,,0,,0,2026-03-17T23:27:23.017732
UgyIeLkzv5SBm-U80gx4AaABAg,xwLrHUwGtJM,@adjo4518,,"Your parents other children are your half siblings not your step siblings,step siblings are children your step parents (step mum or step dad) had before marrying your parent.",13,2026-03-08T01:39:50.214728+00:00,,0,,0,2026-03-17T23:27:23.012759
UgwwwuFz9dRv4Wchh1V4AaABAg,xwLrHUwGtJM,@francesaanderson4870,,"Someone should tell this girl,she is intelligent and wise🥰",9,2026-03-08T01:39:50.214707+00:00,,0,,0,2026-03-17T23:27:23.010911
UgzQeNI-tXbdpCKQi-V4AaABAg,xwLrHUwGtJM,@akosua_adu_boahemaa,,"Video editor you are excellent at your work and I admire it .

Can I be your student?
I want to learn your skill.

Thank you konnected mind ❤ for  giving us the best always .",22,2026-03-08T01:39:50.214687+00:00,,0,,0,2026-03-17T23:27:23.009144
UgwUa8AFq5-mtBVfEaF4AaABAg,xwLrHUwGtJM,@reginaldcobbina,,Not me smiling throughout the conversation 😭❤️,28,2026-03-08T01:39:50.214621+00:00,,0,,0,2026-03-17T23:27:23.001986
UgwBXuIfumdeFzigf3t4AaABAg,xwLrHUwGtJM,@emmanuelkoranteng894,,"That thing she said that life is a movie and she's part of the main characters and she believes everything would go well for her, I believe is the game changer. That feeling of belief that everything would go well.",27,2026-03-08T01:39:50.214558+00:00,,0,,0,2026-03-17T23:27:22.998316
Ugyv-J27DGTxf7UqTdl4AaABAg,t38LbMVoPCs,@RobertYoung-ml4kr,,"Here's a guy that has no formal police experience nor reportable college credentials & a former worker for Elizabeth Taylor & Hollywood celebrities & parlayed these wealthy contacts into a good b.s.line & salesman skills. I loved his condescending quote about retired ""overweight"" cops. Retired major east coast city's career LEO, 2nd gen. & not overweight.",4,2026-03-07T03:52:34.726945+00:00,,0,,0,2026-03-17T23:52:47.982223
Ugzyzp3A8PDTf1XnWmV4AaABAg,t38LbMVoPCs,@information251,,Brilliant interview! Please bring Gavin de Becker back. This was fascinating.,4,2026-03-07T03:52:33.908256+00:00,,0,,0,2026-03-17T23:52:47.978230
Ugynu74te9SjFAZV4uN4AaABAg,t38LbMVoPCs,@claudiawinkelmann1698,,"Some people have been groomed as young people to have psychopathic tendencies, but it’s also been scientifically proven that the more money/power you have/hoard, even well meaning people, the closer your brain changes to match a psychopaths!!! We need to account for this by ensuring that everyone entering or already within all the positions of authority, everyone from scout leaders & teachers to security, police, judges and government, are required to take a psychopathy test annually!",6,2026-03-07T03:52:33.908231+00:00,,0,,0,2026-03-17T23:52:47.977317
Ugy-T7JgVY436QMIBzd4AaABAg,t38LbMVoPCs,@VinFiftyOne,,Jeffery Epsteins job is done. We are in the after math of “their” plan… ladies and gentlemen please understand that we need to stand up against this evil.,4,2026-03-07T03:52:33.908074+00:00,,0,,0,2026-03-17T23:52:47.973356
UgzpKJlkTxXV_PWwlGR4AaABAg,t38LbMVoPCs,@Sudarsh8,,Y'all sitting here thinking there was any autonomy in releasing this podcast lol,6,2026-03-07T03:52:33.173530+00:00,,0,,0,2026-03-17T23:52:47.963323
Ugzmg3gSgwHhitzOUK54AaABAg,t38LbMVoPCs,@LatestSierraLeoneMusic,,This guy dropping intense knowledge for 100 minutes straight,138,2026-03-07T03:52:30.154953+00:00,,0,,0,2026-03-17T23:52:47.917758
UgxIcsMkOzYeGIsCQjp4AaABAg,t38LbMVoPCs,@ReedersNook,,"I dont want a phone anymore. In fact, I dont want internet or tv either. Im done with this society",264,2026-03-07T03:52:29.322347+00:00,,0,,0,2026-03-17T23:52:47.906865
UgwOTttszJG82bo5t7F4AaABAg,e9dljIL4rBk,@mindhoc,,"Andrew knows what he’s talking about , the others … it’s like they are reading comic books",4,2026-03-07T03:52:19.143702+00:00,,0,,0,2026-03-17T23:52:24.143117
Ugxpmbuv0oLUykWySOh4AaABAg,e9dljIL4rBk,@ranharel7033,,"great conversation thank you!
As an Israeli who after Oct. 7 fully understood the absurd level of groupthink that my entire country (and the west) was in and allowed Oct 7 to happen, I can't help but see the same groupthink in certain Western intellectuals alive and well:

1. ""It's all because of us"" - as demonstrated in the beginning of the conversation, where Iran is the way it is ""because of the West"" because of the US meddling some 70 years ago. As if meddling in others' affairs wasn't just what was done, always, and is the sole reason why 70 years later there is no running water in Teheran. Please. There is a deep ideological tradition of Islamic revival from al-Banaa to Khotoub that motivates the so-called ""Islamic revolution"" that is about THEM, not about US. 
2. ""It's about the Gaza war / Palestinians / Settler-colonialism"" - see my point #1. Iranian actions have killed more Arabs and Muslims at several orders of magnitude more than the entire Israeli-Arab conflicts combined from 1917 until today. Israel is the ""small Satan"" and America is the ""big Satan"" because the West in it's ideological entirety (liberalism, secularism, capitalism) is the reason that political Islam has failed to live up to it's former glory. 
3. ""I don't care that they say ""Death to X"", they don't REALLY mean it, they'll 'growup'"". Yes they do. They really do. Give them the dignity of taking them at their word. Andrew perfectly demonstrates this orientalist fallacy at 50:05 .
4. ""International law"" - if you think that Russia / Iran / N. Korea / China cares at all about international law, then I have a bridge to sell you.",6,2026-03-07T03:52:18.342564+00:00,,0,,0,2026-03-17T23:52:24.132689
UgzrS2SydEO3WdW5NQd4AaABAg,e9dljIL4rBk,@larshildebrandt3835,,"Arguably ""Everyday Spy"" gives a great definition of a ROGUE NATION... which by HIS definition; AMERICA IS A ROGUE NATION!!",5,2026-03-07T03:52:18.342542+00:00,,0,,0,2026-03-17T23:52:24.131895
UgyrfkUWiAq5rBDqv294AaABAg,e9dljIL4rBk,@KindaHibrawi,,A frustrating debate when there is only one person who is not influenced by the country causing chaos in the region since 1948. Thank u Andrew for bringing real intelligence to the table.,4,2026-03-07T03:52:17.575912+00:00,,0,,0,2026-03-17T23:52:24.124383
Ugz-0grh2Vffbfu_ugV4AaABAg,e9dljIL4rBk,@lazzymybeat7030,,"Hi Steven, well done. This debate blew my socks off. I LOVED it. Well done again on how you controlled the table and kept everyone civilised.",6,2026-03-07T03:52:15.970215+00:00,,0,,0,2026-03-17T23:52:24.106851
UgzpX1ikmR4YUeKGOTx4AaABAg,e9dljIL4rBk,@Peacchhhyyyyy,,The justification of an illegal war & killing of innocent ppl is crazy to me.,22,2026-03-07T03:52:14.435296+00:00,,0,,0,2026-03-17T23:52:24.084755
Ugw19ei_moWmFJLgefN4AaABAg,e9dljIL4rBk,@JoseSanchez-nz3lq,,"The bottom line is that if a country doesn't have nuclear weapons, the United States will control it and will take their natural resources. If a country has nuclear weapons, then the United States try to negotiate and install their military bases.",4,2026-03-07T03:52:13.636060+00:00,,0,,0,2026-03-17T23:52:24.074083
UgxNwHPdyLQeVkkQ_qd4AaABAg,e9dljIL4rBk,@777TBarrrrr,,"Thank you for this conversation.
And thank you for having it on a platform where everyone isn't just screaming at each other to have their voices heard.",22,2026-03-07T03:52:11.294758+00:00,,0,,0,2026-03-17T23:52:24.043889
UgwzC-hvfDw6XA1XcvF4AaABAg,e9dljIL4rBk,@Rep1313,,"i absolutely was glued to this for the full 2 hours…it made me uncomfortable, it made me think about things in different ways, i respect every panelist and found them each to be engaging and genuine. thank you so much for this ❤",31,2026-03-07T03:52:09.925555+00:00,,0,,0,2026-03-17T23:52:24.024940
Ugyne82rORBlPJH-cHd4AaABAg,e9dljIL4rBk,@whosyedarbaz,,Andrew seems to be the ONLY unbiased and with a sensible guy on the panel with reasonable arguments,42,2026-03-07T03:52:09.925449+00:00,,0,,0,2026-03-17T23:52:24.022167
UgwAgy1QHB0olQ4z-WR4AaABAg,e9dljIL4rBk,@onixtheone,,"You can’t trust everything you hear, Andrew is right, our president said “no war with Iran” look at us, he said”what files??” Look there’s 6 million of them now with only access to 3..

He may sound pessimistic or paranoid( but remember no one listened to the security advisor of the World Trade Center when he said the most vulnerable way we could get attacked is by air.",58,2026-03-07T03:52:09.210982+00:00,,0,,0,2026-03-17T23:52:24.015537
UgwJQ1HOBewc2aFUxmN4AaABAg,e9dljIL4rBk,@Mst0913,,"Why this expert is saying “The lines are blurred in Middle East”. So basically, in Middle East everyone is military combatants - all civilians, even elementary school girls apparently.",14,2026-03-07T03:52:09.210949+00:00,,0,,0,2026-03-17T23:52:24.013089
UgyL_18Z3z4PA9L2kqR4AaABAg,e9dljIL4rBk,@CryptiqueFlow,,This is the greatest round table discussion group in the world right now. Thank you all for these!,6,2026-03-07T03:52:09.210936+00:00,,0,,0,2026-03-17T23:52:24.012650
UgwFweoh2NPaJhld6rx4AaABAg,e9dljIL4rBk,@shaymaaharchich5760,,This conversation completely ignored the elephant in the room of how powerful the US is being influenced. Shame they were too scared to talk!,11,2026-03-07T03:52:08.503915+00:00,,0,,0,2026-03-17T23:52:24.005242
Ugwa1BW34_jo2qXjfaR4AaABAg,e9dljIL4rBk,@TaddySio,,"Listened on Spotify, an my god this lady is so locked into her echo chamber I had to come and comment. Great episode.",51,2026-03-07T03:52:07.685515+00:00,,0,,0,2026-03-17T23:52:23.991783
Ugz0pf2U04w1yJp1f714AaABAg,e9dljIL4rBk,@kidiots,,It would have been complete if you had someone who actually grew up in that region.,101,2026-03-07T03:52:06.968080+00:00,,0,,0,2026-03-17T23:52:23.972312
UgzTV2GZK-UaY3uptL14AaABAg,e9dljIL4rBk,@anthonysolis8933,,Putting this panel together in this way is a great example of why this channel is successful.,580,2026-03-07T03:52:06.295589+00:00,,0,,0,2026-03-17T23:52:23.964879
Ugw01xPVUGw31_3UfwN4AaABAg,YQPc-6pfCHI,@yktv8165,,The Bible is Timeless,0,2026-03-07T02:45:08.135735+00:00,,0,,0,2026-03-17T22:45:11.396800
