comment_id,video_id,author_name,author_channel_id,text,likes,published_at,updated_at,is_reply,parent_id,reply_count,scraped_at
UgxdQ3EbFkGAk8NY_Px4AaABAg,xcXfcXJvMXg,@shantanusapru,,"Apart from a few distorted 'facts' & interpretations, this interview was solid!!",4,2026-03-13T03:51:31.429933+00:00,,0,,0,2026-03-17T23:51:38.339957
Ugw76n3v08yFCtyJSWB4AaABAg,xcXfcXJvMXg,@JahEeGee,,Dynamite interview,5,2026-03-13T03:51:30.585533+00:00,,0,,0,2026-03-17T23:51:38.337358
UgyFoq0uFB5q4MnBdAB4AaABAg,xcXfcXJvMXg,@Coolpersianlion,,"As an Iranian person who lived in Iran for most of my life. Majority of Iranians want to get rid of this regime. We tried everything to make this happen internally and everytime they killed thousands of people. No Iranian wants war but they see it as the only chance to get rid of this regime with international supprt. We are not stupid, we know it is not a charity opperation and we think it can be a win win situation for all. Please please please believe this regime when they say death to America and Israeel. They mean it. The moment they have the chance they do it as they did it before. Don’t let another hitler take the world and realize it before it is too late. Thanks for ur support people of the world ❤",50,2026-03-13T03:51:30.585520+00:00,,0,,0,2026-03-17T23:51:38.337004
Ugwl1KwhF9bicP-Sn0h4AaABAg,xcXfcXJvMXg,@jimhartory,,Love your show!! Keep it up,10,2026-03-13T03:51:30.585316+00:00,,0,,0,2026-03-17T23:51:38.331493
Ugy-oWcGKNXTS3d22H14AaABAg,xcXfcXJvMXg,@nelsonusher5526,,Hell yeah getting in early!,11,2026-03-13T03:51:30.585296+00:00,,0,,0,2026-03-17T23:51:38.331131
UgygFGUuI5NjtERnzph4AaABAg,xcXfcXJvMXg,@ZekeOrtega-k8x,,Great interview,5,2026-03-13T03:51:30.585248+00:00,,0,,0,2026-03-17T23:51:38.330768
Ugw25V9jqAcCOfLHHhB4AaABAg,xcXfcXJvMXg,@aaronrunswithYahweh,,Your forgetting that MOSSAD is probably already in there searching - probably have already been searching for the last few years+.,18,2026-03-13T03:51:28.778784+00:00,,0,,0,2026-03-17T23:51:38.330395
UgzsKNJ1f7jZFJyVngJ4AaABAg,xcXfcXJvMXg,@jaskari1,,Damn im early,11,2026-03-13T03:51:28.778771+00:00,,0,,0,2026-03-17T23:51:38.330015
UgxB-L58sa-y6pXJWmN4AaABAg,xcXfcXJvMXg,@HelenRich-u2x,,Trump is constantly trying to put out his own fires. The Iran Nuclear deal was successful. Years of negotiations. He just ripped it up and created the situation we have now. Thank you for addressing this.,9,2026-03-13T03:51:28.778748+00:00,,0,,0,2026-03-17T23:51:38.329340
UgxsBwNvkwNbVyPVKOx4AaABAg,xcXfcXJvMXg,@Maria-r4q7f,,"Iran has been accused of making nuclear bomb for 25 yrs but proved nothing, same what they did to Iraq. And anyone with the accent like that don't trust them!",38,2026-03-13T03:51:28.778725+00:00,,0,,0,2026-03-17T23:51:38.328619
UgwcM_d5OYz8n1UviSZ4AaABAg,xcXfcXJvMXg,@trigglabs,,"This was interesting, but it was pretty hard to believe that our satellite imaging wasn't sophisticated enough to track where all those trucks went to determine the new destinations of the uranium. I'm also curious why he isn't working for the current WH administration.",20,2026-03-13T03:51:28.778713+00:00,,0,,0,2026-03-17T23:51:38.328273
UgxaqizKriwqCJnbDfF4AaABAg,xcXfcXJvMXg,@ILLVASECKIS,,"""We know that it is dispursing, but we don't know where it is"" - how much sense does this statement make?!",12,2026-03-13T03:51:28.778701+00:00,,0,,0,2026-03-17T23:51:38.327900
UgxzGpg5q8E8jZQ4O394AaABAg,xcXfcXJvMXg,@curry_online,,Calling the guy that was in charge of secretly violating nuclear weapons treaties to develop them in secret a “guardrail against nuclear weapons” is next level in stupidity. This lad loves the sound of his own voice a bit too much.,8,2026-03-13T03:51:28.778663+00:00,,0,,0,2026-03-17T23:51:38.326876
Ugwc4Ab8XEkW-ZfiRfB4AaABAg,xcXfcXJvMXg,@timsmith6700,,"This guy is a wonk and these are the type of guys, when you listen to them and their ""certainty"" , get a lot of war fighters killed.  And keeps the free world from being kinetic in the face of oppressive regimes.",10,2026-03-13T03:51:28.778649+00:00,,0,,0,2026-03-17T23:51:38.326525
UgxCCxbn3HyTa8eyPYl4AaABAg,xcXfcXJvMXg,@coenblackpayne6909,,It's not about politics.. Its about surviving from a neighbor who consistently wants to eradicate you from the face of the earth.,4,2026-03-13T03:51:28.778624+00:00,,0,,0,2026-03-17T23:51:38.325680
UgyE22TIZn9TRkiZVEZ4AaABAg,xcXfcXJvMXg,@このかのほん,,アメリカが始めた戦争なんだから、イランから許しを貰うまで、止めることはできない。中東の米軍基地は、全て無くなり、石油とドルの交換はできなくなります。これは最高に良い話です。,34,2026-03-13T03:51:28.778545+00:00,,0,,0,2026-03-17T23:51:38.323712
UgzJpN9QS5O7w6DVqIB4AaABAg,xcXfcXJvMXg,@UKtilly,,If he don't know it's all about the banking system. He knows jack sh..,15,2026-03-13T03:51:27.896468+00:00,,0,,0,2026-03-17T23:51:38.322963
UgzktRvORFgt9egCNTh4AaABAg,xcXfcXJvMXg,@StopTheWorld65,,"15:47  Right, Khamenei issued a holy decree against nuclear weapons… while the program under him was enriching uranium to 60 percent.

Nothing screams deep moral opposition like doing about 95 percent of the engineering required to build the thing you supposedly banned. Very convincing. Totally checks out.",15,2026-03-13T03:51:27.896450+00:00,,0,,0,2026-03-17T23:51:38.322202
UgxCW-Lklbun7LO0T5l4AaABAg,xcXfcXJvMXg,@franckautomation,,"If this guy is an expert, the war would have never started",4,2026-03-13T03:51:27.896433+00:00,,0,,0,2026-03-17T23:51:38.321477
UgyCAXZoVpzWt865fbF4AaABAg,xcXfcXJvMXg,@Moodydesigner,,Why would they do enrichment if they didn’t want nuclear weapons?,10,2026-03-13T03:51:27.896423+00:00,,0,,0,2026-03-17T23:51:38.321097
UgwNUnLZ95-OP_60EH94AaABAg,xcXfcXJvMXg,@khalido4807,,"Steven, I’m a big fan of your podcast, but this time the conversation felt incomplete. The discussion avoided the root causes of the conflict and didn’t challenge the key issues strongly enough. Why does international law seem to apply strictly to some countries, but not to those who initiate attacks—such as in the case of Iran or during the Gaza war? This deserved tougher and more balanced questioning.",24,2026-03-13T03:51:27.896414+00:00,,0,,0,2026-03-17T23:51:38.320622
UgxEEtimKwC0W-UItBF4AaABAg,xcXfcXJvMXg,@paulomoteso,,"2026 and we are still talking about WARS😢

We are being ruled by psychopaths.",21,2026-03-13T03:51:27.896405+00:00,,0,,0,2026-03-17T23:51:38.320193
UgzUdzB5q3nSzkJeEF54AaABAg,xcXfcXJvMXg,@y7374,,There is a saying: those who talk don’t know and those who know don’t talk. This guy sure talks a lot,22,2026-03-13T03:51:27.896396+00:00,,0,,0,2026-03-17T23:51:38.319676
UgxjeaiuXygwbMOTYIx4AaABAg,xcXfcXJvMXg,@TylerGrant-q6w,,"There’s this guy on the internet, Silas Orven. For months he’s been telling everyone that he came from the future, and in August he said the war would start on February 28. Everyone laughed at him back then, and Facebook even removed him from the platform. Yet today, we see that it actually came true. This is insanity.",100,2026-03-13T03:51:27.896377+00:00,,0,,0,2026-03-17T23:51:38.318745
UgzunAl06wduiaF4w0N4AaABAg,xcXfcXJvMXg,@dicedpineappple,,"great interview so far, can u also invite professor jiang on ??",16,2026-03-13T03:51:27.896367+00:00,,0,,0,2026-03-17T23:51:38.318326
UgyEw5mu3jy4nwr5TGF4AaABAg,xcXfcXJvMXg,@YorkshireTeaNBiccies,,I think “the public” are more clued up than ever. Iran is in control.,34,2026-03-13T03:51:27.896338+00:00,,0,,0,2026-03-17T23:51:38.316890
UgzKjbqeeZQutXqK8SB4AaABAg,xcXfcXJvMXg,@ZahirAmmar,,"We're Iran's neighboring country, Afghanistan and as the rest of the world, we Afghans do not feel safe economically and geopolitically at the moment and that's all because of St*pid Trump and his pro-Israel illegal wars.",23,2026-03-13T03:51:27.896328+00:00,,0,,0,2026-03-17T23:51:38.316469
Ugz3IL6BGVH5ukV6-Fd4AaABAg,xcXfcXJvMXg,@noreenpower6146,,"Even if it stopped tomorrow, Iranians have long memories and upwards of 150 kids isn’t going to be forgotten any time soon",23,2026-03-13T03:51:27.896292+00:00,,0,,0,2026-03-17T23:51:38.315113
UgzFuiTVZMB8TJpreW94AaABAg,xcXfcXJvMXg,@SeanSmithyHammer,,"Really loved this interview.  Loved the guest and all of the information, perspective.",5,2026-03-13T03:51:27.896248+00:00,,0,,0,2026-03-17T23:51:38.314668
UgyNfV_xJMrpERNNP5h4AaABAg,xcXfcXJvMXg,@michaelzampini5388,,"Nice discussion.
Excellent insight.
I can't help but wonder, what is it that he is not telling us.
Well done.",6,2026-03-13T03:51:27.192558+00:00,,0,,0,2026-03-17T23:51:38.310615
UgzOX_zRnnKTZrUFe8x4AaABAg,xcXfcXJvMXg,@giselleabadie6033,,This is a very informative talk - he explains escalation of conflict-war I simple terms …,6,2026-03-13T03:51:27.192518+00:00,,0,,0,2026-03-17T23:51:38.309427
Ugz883lrxgbE-Pvwk7B4AaABAg,xcXfcXJvMXg,@alexchristodoulou,,Excellent episodes on Iran. It would be groundbreaking to have an Iranian and give is insights on Iran’s internal views.,44,2026-03-13T03:51:27.192465+00:00,,0,,0,2026-03-17T23:51:38.307756
Ugxxi3nqff-oKUo7Bap4AaABAg,xcXfcXJvMXg,@darylspackman,,I listened to like 15 minutes before I thought this guy is full of shit. He is a alarmist not because he cares but because that is how he makes his money. Just like all the green energy stuff,29,2026-03-13T03:51:26.523316+00:00,,0,,0,2026-03-17T23:51:38.305368
Ugx19SfVlD4AkX0o--R4AaABAg,xcXfcXJvMXg,@HS-vz6jd,,"It is truly unfortunate that we still hear such arrogant rhetoric, even when military experts admit their own defeats. Describing people who defend their land as ""bad guys"" or ""the evil side"" is a living embodiment of the imperialist mindset that still controls the Western narrative of conflicts.
What this strategic expert said reflects a terrible double standard:

1. When they occupy: They call it ""spreading democracy"" and ""liberation.""
2. When they are resisted: They call the resistors ""terrorists"" or ""evil.""
3. When they are defeated: They look for a false moral explanation (""How do we lose to these people?"") instead of reviewing the act of occupation itself as a crime.

This ""backward"" mentality, does not stem from a lack of intelligence, but from an arrogance built on a false sense of superiority.",52,2026-03-13T03:51:26.523304+00:00,,0,,0,2026-03-17T23:51:38.305026
UgwEaBg9mJ812btX8bN4AaABAg,xcXfcXJvMXg,@videotube3968,,In one sentence he says the old supreme leader did not want to pursue nukes and in the next sentence he says Iran has been working towards a nuke since 2018. Iran took a downed American drone in 2011 and in 15 years has reverse engineered that drone to be built better and more cost effectively to the point that Americans are now reverse engineering Iran's drones. Doesn't seem like a country that would not have a nuke if they actually wanted one.,34,2026-03-13T03:51:26.523292+00:00,,0,,0,2026-03-17T23:51:38.304696
UgzGQItEkll3p79J8Cd4AaABAg,xcXfcXJvMXg,@AZGATOR2002,,"If this guy is so smart and such a great advisor, why are we at war?",7,2026-03-13T03:51:26.523269+00:00,,0,,0,2026-03-17T23:51:38.304000
UgzSOFyfRug1uRCzFqx4AaABAg,xcXfcXJvMXg,@paulasmith8981,,"I have to say I love your podcasts Steven 
They’re all so binge worthy 
You’ve got an incredibly soothing voice",6,2026-03-13T03:51:26.523208+00:00,,0,,0,2026-03-17T23:51:38.302191
UgzPxMN9J_neiUUVV9h4AaABAg,xcXfcXJvMXg,@RobertoSantiago-d9c,,Not that your other videos are lacking in any way but this particular conversation was fascinating.   You do great work!,19,2026-03-13T03:51:26.523167+00:00,,0,,0,2026-03-17T23:51:38.301095
UgzOesoJlN8s0tigyjx4AaABAg,xcXfcXJvMXg,@YuriStrikes,,31:00 I literally changed my flights to Japan just to avoid flying over that whole area. And I don't plan on flying other that area any time soon. I guess Iran's strategy is working,10,2026-03-13T03:51:26.523138+00:00,,0,,0,2026-03-17T23:51:38.300317
UgyPoZVqMtmGkN0CyDV4AaABAg,xcXfcXJvMXg,@poojasharma-xc9un,,"While there intelligence pin pointedly targeted the leadership and eliminated them all together, how come they are clueless about the nukes, it’s just hoax",10,2026-03-13T03:51:26.523124+00:00,,0,,0,2026-03-17T23:51:38.299956
UgwCGS0Q7xDzA7UiPB94AaABAg,xcXfcXJvMXg,@tomaston97,,"If you haven't heard of Dorian Lorne, his story is honestly eye-opening. He's been talking about some disturbing things for years and a lot of people said he was lying. Now more people are starting to listen.",111,2026-03-13T03:51:26.523043+00:00,,0,,0,2026-03-17T23:51:38.298838
UgwCGa0-vyyuxy8i9bN4AaABAg,xcXfcXJvMXg,@householdone7559,,"Hang on.... the 1st thing he said was they have nuclear material.... yet no intelligence agency has said that....  I'm curious as to where this guy gets his info.
They weren't going for a nuke... but now.. they'd be stupid not to.",89,2026-03-13T03:51:25.703877+00:00,,0,,0,2026-03-17T23:51:38.297698
UgzBroFITF4e9so5-FR4AaABAg,xcXfcXJvMXg,@latestmovies2016,,"So basically put, Israel and USA attacked Iran to do a regime change to ensure they would never build a nuclear bomb. Got it. Wait but at the same time you say they never wanted to build a nuclear bomb and we had a treaty that trump tore up and just before we attacked them they agreed to a new nuclear deal ? You don’t make sense dude",27,2026-03-13T03:51:25.703856+00:00,,0,,0,2026-03-17T23:51:38.296776
UgyXHNsFTumMqwtRmiJ4AaABAg,xcXfcXJvMXg,@HakimLitim-xr3ft,,This is hands down one of the best podcast iv seen Steve!,4,2026-03-13T03:51:25.703846+00:00,,0,,0,2026-03-17T23:51:38.296421
UgwJ4v7yzhqsx_9Cd854AaABAg,xcXfcXJvMXg,@videowatcher314,,He lost me when he confidently said that Khamenei forbade nuclear weapons while also developing them because he was only developing the materials not the weapon...,35,2026-03-13T03:51:25.703837+00:00,,0,,0,2026-03-17T23:51:38.296011
UgwrGzH60yYGHznVT0B4AaABAg,xcXfcXJvMXg,@marirooney9910,,He uses ICE as example of violence?? Not charlie Kirk or multiple attempts  on Trumps life. Wth??,6,2026-03-13T03:51:25.703827+00:00,,0,,0,2026-03-17T23:51:38.295648
UgzEmKaK6-F447o5-mp4AaABAg,xcXfcXJvMXg,@glovs55,,So this is the advisor that would rather pay terrorists than just straight up wiping them out.,9,2026-03-13T03:51:25.703818+00:00,,0,,0,2026-03-17T23:51:38.295314
Ugz8VRgMFq9XONlX4il4AaABAg,xcXfcXJvMXg,@GEAR_DADDY,,Bruhhh 1am now I gotta finish this video,5,2026-03-13T03:51:25.703799+00:00,,0,,0,2026-03-17T23:51:38.294520
Ugx_F4XDndOfSfSQIzt4AaABAg,xcXfcXJvMXg,@ToddMark-d9b,,I am from Jordan middle east every day we hear sounds from bomb sometimes its fall over us its really bad scary we are living as peace country why we should enter this war,20,2026-03-13T03:51:25.703778+00:00,,0,,0,2026-03-17T23:51:38.293772
Ugxc4JztpXohD34-tlh4AaABAg,xcXfcXJvMXg,@loraineharnisch4027,,"THANK YOU SO VERY MUCH for bringing Prof. Pape to the American people.

I've been sharing this across platforms and on different social media platforms. 

THIS is exactly what American people need more of:  Clear education regarding domestic and foreign affairs in the era of chaos.",10,2026-03-13T03:51:25.703768+00:00,,0,,0,2026-03-17T23:51:38.293444
UgwiQg922KXalLcfpjx4AaABAg,xcXfcXJvMXg,@moneybuilden,,They guy isn’t lying when he said the ayatollah was against nuclear weapons—now think about that cause the media will have you thinking other wise,39,2026-03-13T03:51:25.703758+00:00,,0,,0,2026-03-17T23:51:38.293112
UgzArpUOuJsG7V_w3z94AaABAg,xcXfcXJvMXg,@no_till3353,,"How does he know that usa doesn't know where the material is? 
They're gonna let a a random guy going on a podcast and talk about whether they know or don't know where this material is. Lmao",19,2026-03-13T03:51:25.703734+00:00,,0,,0,2026-03-17T23:51:38.292320
UgwCTnmjL0Hi4G9X6-d4AaABAg,xcXfcXJvMXg,@divijsharma5610,,My question is why is USA concerned about Nuclear weapons in IRAN.  North Korea leader has it ans nobody is more insane than him.    Actually USA is concerned about losing control and power . Villain is again USA.,6,2026-03-13T03:51:25.703722+00:00,,0,,0,2026-03-17T23:51:38.291921
Ugzf9YZgvnag0NVgsoN4AaABAg,xcXfcXJvMXg,@Amarjeen,,"In fact Hezbollah was established with Iran’s backing after the 1979 revolution, under Ayatollah Khomeini. The Iranian regime played a founding role in supporting Hezbollah and other militant groups.",22,2026-03-13T03:51:25.703667+00:00,,0,,0,2026-03-17T23:51:38.291199
UgyBs037r_vno85-a454AaABAg,xcXfcXJvMXg,@azadnezamdoust,,I dont trust people who has no execitive experience and do study only. It is like a mathematician talking about the engine and saying engineers know nothing.,8,2026-03-13T03:51:24.310497+00:00,,0,,0,2026-03-17T23:51:38.289952
Ugw9HLybPtaAiU_4QeJ4AaABAg,xcXfcXJvMXg,@dasein9980,,False flag operations incoming,48,2026-03-13T03:51:24.310480+00:00,,0,,0,2026-03-17T23:51:38.289593
UgxCZz7fKd0Pf2ddCUZ4AaABAg,xcXfcXJvMXg,@bigwill8145,,"A deal would be nice, but at the same time, if anybody thinks that they're not secretly still enriching uranium somewhere else you're insane?",5,2026-03-13T03:51:24.310429+00:00,,0,,0,2026-03-17T23:51:38.288487
UgwkmqDdUT3u1vFD67Z4AaABAg,xcXfcXJvMXg,@robertfoertsch,,"Deployed Worldwide Through The TRUTH Network …
Thank You 🙏 ❤",8,2026-03-13T03:51:24.310410+00:00,,0,,0,2026-03-17T23:51:38.288124
Ugy_2uMd7AgHE7Dlg_R4AaABAg,xcXfcXJvMXg,@midknight,,"Imagine you were living your life then someone breaks into your house, steals all your stuff, wrecks all your furniture, and unalives your dog… and when you get mad, and decide to take revenge, the criminal calls the cops on you and accuses you of being the perpetrator.. If Obama did this to Venezuela and Iran, Republicans would have impeached him on the same day",54,2026-03-13T03:51:24.310393+00:00,,0,,0,2026-03-17T23:51:38.287698
Ugyy2LcFPpwJGMw468Z4AaABAg,xcXfcXJvMXg,@munyaradzichabata6436,,Was one of the pple that wasn't subscribed and just figured it out today,4,2026-03-13T03:51:24.310375+00:00,,0,,0,2026-03-17T23:51:38.287270
UgzQRkyCXAFsXQzZ4U14AaABAg,xcXfcXJvMXg,@marirooney9910,,**Why's this guest almost upbeat about whats going wrong???,23,2026-03-13T03:51:24.310358+00:00,,0,,0,2026-03-17T23:51:38.286863
UgwKMmOWuNLP3awSWt54AaABAg,xcXfcXJvMXg,@AndrewLXiong,,"Love this guy…so smart, and honest brutal truth",6,2026-03-13T03:51:24.310341+00:00,,0,,0,2026-03-17T23:51:38.286355
UgyR5FzEnbQtSs5WYFt4AaABAg,xcXfcXJvMXg,@MSCH1954,,In my view this gentleman is not aware of Taqqiya.,69,2026-03-13T03:51:24.310323+00:00,,0,,0,2026-03-17T23:51:38.285854
UgzZh9XrcuHP-pSE80F4AaABAg,xcXfcXJvMXg,@ponternal,,Bro been analyzing for 20 years and some random Chinese high school teacher will still somehow predict how this goes more accurately,19,2026-03-13T03:51:24.310272+00:00,,0,,0,2026-03-17T23:51:38.284828
UgxHOWf5krdz-Ro6fSR4AaABAg,xcXfcXJvMXg,@r123ingelderland6,,"True, the old leader prevented building a nuclear bomb, but he was old and sick. Very likely he would have died within a year or so, and then what?
(I am against this war, without any reservations, just trying to think through all the arguments)",4,2026-03-13T03:51:24.310251+00:00,,0,,0,2026-03-17T23:51:38.284472
Ugz2ctZsGHE0oEIPJJ14AaABAg,xcXfcXJvMXg,@ladytorres8323,,"When you have a husband whose whole family was military back to 1800s like mine; who grew up in 12 countries, army brat. Then he and his siblings went into service…he says this man should be listened to. My husband is 64 yrs old now. He has been in conflicts. *America didn’t call war. There is a difference. My husband was a silver star recipient. (Navy) that tells you veterans something.

My grandparents fought WWII… every year of war that the US was involved in . Fought in the  Guadalcanal of the South Pacific. Has pictures of soldiers holding the heads of men that they cut off (* traumatizing to see as a child). However, I was raised to hear the truth about the world. My grandfather was not even 18 when he went into World War II. He lied about his age and was accepted. Back then it was “sign up or do your bit. “ He and his brother signed up the same day. He wasn’t gonna let his brother go alone. My grandfather never planned on coming back alive, but he did.

My husband and and grandfather know enough to say, listen to him. I listen.
They remember history, this generation doesn’t have a clue about what has gone on in the past and they call it fake.

Also, please don’t say thank you for your service to my husband or grandfather because they are quite disgruntled with government after learning about it. They don’t do politics. They are soldiers and sailors. Brother-in-law, Air Force. My brother air force. 
Kind Regards to all . My family views every human worthy of life. No matter where you live. 

My family signed up because they believed in their country and mamas apple pie on Sundays. Family was important to them.

They came to realize their enemy signed up for the same reasons. Just a different dessert on Sunday very sad.",23,2026-03-13T03:51:24.310209+00:00,,0,,0,2026-03-17T23:51:38.283718
UgzDuFiW7_0MANSNkvt4AaABAg,xcXfcXJvMXg,@Wisdom.uk-q2b,,"Those who fight these wars do so for power, control, and their own interests. Yet they rarely think about the innocent people who must face the brutal consequences of their decisions. It is not the leaders who suffer — it is ordinary men, women, and children whose lives are shattered. Homes are destroyed, families are torn apart, and countless innocent lives are pushed into unbearable pain. What victory is worth such cruelty? What kind of achievement comes from causing such immense and unspeakable suffering to fellow human beings?",13,2026-03-13T03:51:23.595890+00:00,,0,,0,2026-03-17T23:51:38.282987
UgxPGBEqj08PeUnqXad4AaABAg,xcXfcXJvMXg,@HumanAki,,"The most defeating near-certain fact is, regardless of how this ends, whomever is in charge will still be part of the P*do Billionaires and nothing will change; other than mass casualties.",72,2026-03-13T03:51:23.595872+00:00,,0,,0,2026-03-17T23:51:38.282083
UgyHAxFPtppvOy7KZl14AaABAg,xcXfcXJvMXg,@courtlandmedia,,"the world is dumb.  there is only one reality, we’re all gonna burn. God have mercy on us all.",44,2026-03-13T03:51:23.595862+00:00,,0,,0,2026-03-17T23:51:38.281712
UgxHfve7vu4NJPdHFeN4AaABAg,xcXfcXJvMXg,@pulsar22,,"Big problem with experts, they think models = real world.  Nope.",60,2026-03-13T03:51:23.595833+00:00,,0,,0,2026-03-17T23:51:38.280618
Ugwa6MW4gCiRSxgBhhF4AaABAg,xcXfcXJvMXg,@Redhare1,,Now I really can’t sleep😂,16,2026-03-13T03:51:23.595804+00:00,,0,,0,2026-03-17T23:51:38.279338
UgzLiFjJ12Wn3KvH2lZ4AaABAg,xcXfcXJvMXg,@kwadwog8168,,Did people not learn from Vietnam and Afghanistan?,104,2026-03-13T03:51:23.595795+00:00,,0,,0,2026-03-17T23:51:38.278944
Ugz40oIxDvtm9LCKmMd4AaABAg,xcXfcXJvMXg,@QueDesBarjos,,"There's NO way Iran will ever sign the same type of nuclear deal again.
They will go ALL the way this time.

They know that they won't ever be safe until they officially acquire such weapons.",20,2026-03-13T03:51:23.595784+00:00,,0,,0,2026-03-17T23:51:38.278572
UgxawbOmQ_WGNc1EiGF4AaABAg,xcXfcXJvMXg,@coldfridayduckcamp2457,,"He said, “we have no idea” way too many times. I doubt we are that clueless",62,2026-03-13T03:51:23.595774+00:00,,0,,0,2026-03-17T23:51:38.278197
Ugzzv6TJLCkylwpXRKR4AaABAg,xcXfcXJvMXg,@nasefc,,Thank you so much for all your post. Greetings from Peru,6,2026-03-13T03:51:23.595764+00:00,,0,,0,2026-03-17T23:51:38.277769
UgzRl2SHlIbvJ5yA4ux4AaABAg,xcXfcXJvMXg,@lightskinninja9340,,This man speaks so much truth! If only we had this level of thinking actually running our nation,4,2026-03-13T03:51:23.595743+00:00,,0,,0,2026-03-17T23:51:38.276991
Ugz3hGN3xyJ4c2r3ld94AaABAg,xcXfcXJvMXg,@LaRae55,,Faithful viewer here. One small favor to ask is that when you have guests on that have written books will you consider showing the book? It would be nice. Thank you.,19,2026-03-13T03:51:23.595722+00:00,,0,,0,2026-03-17T23:51:38.276253
UgwWI4ulp6JqxiLlr4B4AaABAg,xcXfcXJvMXg,@Shroudmusic8,,"US will lose yet another senseless war, what a surprise, what an empire",55,2026-03-13T03:51:23.595705+00:00,,0,,0,2026-03-17T23:51:38.275891
UgwHdP80K_WHsOmmKa14AaABAg,xcXfcXJvMXg,@KenPoirier-l6v,,Thank you Steven and Professor Pape! I thought this was a very intriguing conversation and appreciated the questions and viewpoints.,8,2026-03-13T03:51:22.515921+00:00,,0,,0,2026-03-17T23:51:38.275129
UgwDChI9WdIK6HB2KWF4AaABAg,xcXfcXJvMXg,@andreah1124,,"This guy is helping to sow the they have ""weapons of mass destruction"" story in the public.  Exactly why he's on this podcast that reaches so many people.",44,2026-03-13T03:51:22.515892+00:00,,0,,0,2026-03-17T23:51:38.274021
